"21270","Would you like to hear about the Battlefield Quest? Or would you like to enter the battlefield?"
"21275","We've let loose a great number of Goblins to test the level 40 people. These Goblins are hungry for battle. They'll be attacking you from all directions. Fight them!! You'll gain experience points everytime you kill a goblin until you level up."
"21281","Would you like to hear about the Silver Cross? Or did you already complete the quest? "
"21283","I increase levels for Level 50~53 people that brings me the Silver Cross."
"21284","Ask the captain in your own nation about the Silver Cross. "
"21287","I'm sorry but you need to be in between level 50~53 in order to do the Silver Cross quest. Come back after you level up. "
"21288","I'm sorry but you lost your chance. People at level 50~53 are only allowed to do this quest. "
"21289","You've already completed the Silver Cross quest. "
"21290","Where's the Silver Cross? You'll need to bring that to complete this quest. "
"21291","Oh~ You've received the Silver Cross from your captain. Good!! I'll now increase your level. "
"22000","I'm Priest Athian of the Forgotten Temple!! Do you want to get out from this place? "
"22001","I'm the Judge of the Quest!! Would you like to get out of here? "
"22002","I'm Barrel, the battle field manager!! Do you want to exit from here? "
"22003","Snowman Poroom, Teeti, Theo & Nunu are paying a visit to the world of Knight Online this X-Mas~|You can hunt various monsters to collect items to turn into one of the snowman. Try collecting the following items to change into one of the snowman!|*** Requirements for Transformation ***|Snowman Poroom: Large Snow (5)+ Small Snow (5) + Poroom`s Glove(5)+Poroom`s Hat(5)+Poroom`s Muffler(5)|Snowman Teeti: Large Snow (5)+ Small Snow (5) + Teeti`s Glove(5)+Teeti`s Hat(5)+Teeti`s Muffler(5)|Snowman Theo: Large Snow (5)+ Small Snow (5) + Theo`s Glove(5)+Theo`s Hat(5)+Theo`s Muffler(5)|Snowman Nunu: Large Snow (5)+ Small Snow (5) + Nunu`s Glove(5)+Nunu`s Hat(5)+Nunu`s Muffler(5)"
"22012","Need more Large Snow"
"22013","Need more Small Snow"
"22014","Need more Poroom`s Muffler"
"22015","Need more Poroom`s Glove"
"22016","Need more Poroom`s Hat"
"22017","Have a wonderful X-Mas!"
"22020","Come see me if you ever want to get out of here. "
"22024","Need more Teeti`s Muffler"
"22025","Need more Teeti`s Glove"
"22026","Need more Teeti`s Hat"
"22034","Need more Theo`s Muffler"
"22035","Need more Theo`s Glove"
"22036","Need more Theo`s Hat"
"22044","Need more Nunu`s Muffler"
"22045","Need more Nunu`s Glove"
"22046","Need more Nunu`s Hat"
"22050","Snowmans affected by Patos` curse are attacking people out in the battlefield instead of delievering presents.|Please collect 5 snowman item by hunting these cursed snowmans in the battlefield.|I`ll give you candy cane in return as a token of my gratitude. "
"22056","Snowman requires 5 people."
"30001","Hello, this is the Knight Online Special Store. In order to access the Special Store, you must access the [Power-up Store] and enter the [Special Store]. Press the button on the item you want to buy from the menu below. "
"30060","You need to buy the [Scroll of Identity] in order to change your ID. You can buy the [Scroll of Identity] from the [Power-up Store]. "
"30065","You can change your ID only once with the [Scroll of Identity]. Once you change your ID, the old ID cannot be used again in anticipation of fraud. Please select your new ID carefully. "
"30075","Thank you for using the [Special Store]. Have a nice day. "
"30102","You need a [Redistribution Item] in order to redistribute your points. You can get the [Redistribution Item] by purchasing the Ultra Premium service from the [Power-up Store]. "
"30110","You can redistribute your points only once with the [Redistribution Item]. Please redistribute your points carefully. "
"30121","Redistributed Skill Points. "
"30122","Redistributed Stat Points. "
"30131","You can receive help from high leveled users by joining the Beginner Helper event. When you reach level 30 through the Beginner Helper event, you'll be awarded with 500,000 coins.|| Users with level 35 or above can help out beginners by inviting them into their party. They'll earn manner points for this. You can check the manner points in your stat window. "
"30134","Come back again when you need help. ^^"
"30135","You have to level 1~20 in order to sign up for the Beginner Helper event. "
"30137","You've already signed up for the Beginner Helper Event. Please come back when you reach level 30. "
"30138","You have successfully signed up for the Beginner Helper Event. "
"30139","You have not reached level 30 yet. "
"30141","You've completed the quest. "
"30142","Congratulations! You've reached level 30. "
"31001","I am Galowin, the advisor for Clan Matches. What would you like to know about?"
"31011","Clan Match.. Blah.. Blah.. Blah.. "
"31101","The winner of the clan battle is ******* clan. "
"31131","The silver trophy winner of the clan battle is ******* clan. "
"31161","The bronze trophy winner of the clan battle is ******* clan. "
"35001","Young adventurer!! There are many dangers lurking in this land. It's your obligation to fight through these dangers. If you complete a mission that I give, then I'll give you a reward. Please select the mission you want to complete. "
"35002","You need to be level 10 or above in order to do that mission. Come back after a little more training. "
"35003","From what I recall, you've already completed that mission. Do you want to repeat the mission? "
"35004","You want to exterminate Worms? The Worms are too weak to be called a monster but they multiply very rapily so it's very difficult to get them to disappear. Do you want to do this mission?  "
"35005","I'll give you a reasonable reward if you hunt worms and bring back 10 Silk Bundles as a proof. "
"35006","You don't have enough Silk Bundles. You need to have 10 Silk Bundles in order to complete this mission. "
"35007","You have 10 Silk Bundles. Will give them to me to complete the mission? "
"35008","I gave you 500 experience points. This is the reward that I promised you. "
"35009","That's too bad. Come back if you ever change your mind. "
"35010","From what I recall, you've already completed that mission. Do you want to repeat the mission? "
"35011","The guards in El Morad and Karus are troubled by the Gavolts that are living near the villages. The Gavolt Wings happen to be a very valuable item for the vendors in Moradon. "
"35012","For [5 Gavolt Wings] I'll give you a small amount of experience points and some Water of Grace.  "
"35013","You don't have enough Gavolt Wings. I require 5. "
"35014","You brought the Gavolt Wings. Will you give them to me to complete your mission? "
"35015","The reward is 700 experience points and 5 Water of Grace. "
"35016","That's too bad. Come back if you ever change your mind. "
"35017","From what I recall, you've already completed that mission. Do you want to repeat the mission? "
"35018","You're not interested in the Silan Quest? The Bulcans feed on the minerals in the earth. Most of the Bulcans store the metals that were in the earth in their stomach, but in some rare cases, the metals get stuck on the scales and bones.  These type of Bulcans are called the Silans. The Silan Bones are used by the blacksmiths to make weapons. "
"35019","Bring me [10 Silan Bones]. I'll repay you with a reasonable reward. "
"35020","There's not enough Silan Bones. You need 10 Silan Bones in order to get the reward. "
"35021","You brought 10 Silan Bones as promised. Will you use them to complete your mission? "
"35022","I gave you 1,000 experience points and 50,000 coins as promised. I hope it was a good present for you. "
"35023","That's too bad. Come back if you ever change your mind. "
"35024","From what I recall, you've already completed that mission. Do you want to repeat the mission? "
"35025","You know what a Bulture Horn is, right? The Blacksmiths use them to make bows. You'll be receive a reasonable reward if you get [5 Bulture Horns]. "
"35026","I'll give you a present if you bring me [5 Bulture Horns]. "
"35027","You need [5 Bulture Horns] to complete this mission. "
"35028","You brough 5 Bulture Horns. Will you use them to complete your mission? "
"35029","I gave you 3,000 experience points as promised. "
"35030","That's too bad. Come back if you ever change your mind. "
"35031","From what I recall, you've already completed that mission. Do you want to repeat the mission? "
"35032","Did you hear about the Wolf Man? They come to loot the village every full moon. The vendors in Moradon are offering rewards for those that hunt down Wolf Man."
"35033","I'll give you a reward if you bring me [10 Fangs of Wolf Man]. "
"35034","You need [10 Fangs of Wolf Man] in order to complete the mission. "
"35035","You brought [10 Fangs of Wolf Man]. Will you use them to complete the mission? "
"35036","I gave you 5,000 experience points and 10 Water of Favors for your service. "
"35037","That's too bad. Come back if you ever change your mind. "
"35201","I'm Miracel, the storage keeper of Delos!! The Delos storage has disappeared to another dimension, but I can retrieve the items that are in Delos storage with the help from magic. I need different kinds of items for retrieving different kind of items. What did you bring? "
"35203","I am Marselis, the keeper of the warehouse here in Delos. If you bring me items that I need, then I will give you items from the warehouse as a reward. But since the warehouse of Delos is deep and dark, even I don't know what items will come out."
"35222","You can do this rabbit event only once. The chances for getting a present should be available to everybody. "
"35223","I'm Adelia from the Heavens! The rabbits of Heaven have escaped through a broken fence to earth. If you get the rabbits back to me, I shall reward you with a present. "
"35224","Thank you for offering your help. Get me [10 Rabbits] and I'll give you a present. It has to be 10. "
"35227","You need to get 10 rabbits in order to get the present from the Heaven. Try a little harder. I'm sure you can catch all 10. "
"35229","Come visit me if you want to help out. "
"35230","You caught 10 rabbits. I'll give you a present as promised. I bet you'll be surprised. Select the present you want from the following. "
"35232","The endless magic dungeon of Abyss was created to lock up the monsters. The monsters are stuck in a limited space they do not age. They wander around looking for a way out. Because they were locked up for so long they have something called Abyss Gem growing on their bodies. You can retrieve items from the lost Delos storage by bringing the Abyss Gem."
"35234","Choose between Lotto Event or Abyss Gem quest. "
"35240","Okay then, please bring the Abyss Gem. I'll retrieve the lost items in Delos storage for you. "
"35245","You don't have the Abyss Gem. You need Abyss Gem in order to retrieve items from the Delos storage. "
"35250","You brought the Abyss Gem. Will you use the gem? "
"35270","Okay then.. You can come look for me anytime. "
"35271","I hope this present will be useful for you. "
"35351","We have released lots of bunnies in the colony zone to commemorate Labor day. Most of these rabbits hold raffles. The ones that don't hold scrolls. If you bring me raffles, then I will give you very useful items."
"35360","Okay then.. Go get a lotto ticket. I'll give you a present when you do. "
"35365","You don't have the lotto ticket. You need to have a lotto ticket in order to get the present. "
"35370","You brought the lotto ticket. Which present do you want? "
"35380","Okay.. Come visit me anytime. "
"35543","Come back again if you ever need my help. "
"35563","Welcome to the peaceful city of Moradon!!| I'm Adien the helper for beginners. I help people on getting started. What kind of question do you have for me <selfname>?"
"35564","Character movement |W: move forward, A: turn left, S: move backward, D: turn right, Y: walk/run, E : auto walk/run, R: press R after selecting a target for auto attack, C: sit/stand (HP/MP recovery when sitting down)"
"35565","Selecting |Left click on mouse : Select target, Left Double-click : Auto attack, B: Select the nearest NPC, Z: Select the nearest enemy/monster, X: Select the nearest party member. "
"35566","Shortcut Key |U: My Status Window, I: Inventory Window, K: Skill Window, M: Map, H: Shortcut Keys, O: Show/Hide ID, F9: Toggle View, F10: View Help"
"35567","Interface |Q button: Displays the quests you can complete at your current level. |P Button: Access Power-up Store. |B Button: Open Blog."
"35568","You can return to your home nation when you finish your Esquire process here. Karus users can go to Breth Village and El Morad users can goto Piana village through the teleport gate to continue their training to become a knight. "
"35569","Karus Teleport Gate (283, 370)| El Morad Teleport Gate (336, 319)| Left click on the teleport gate and then right click to see the list of zones. You can select the zone you want to teleport to from here. The description for each zone will appear on the bottom. "
"35570","You can use the teleport gate in Moradon to teleport to the main village in each nations, Lunar Gate Entrance, Delos, and Colony Zone. You have to pay a small fee for each teleport. "
"35571","There are many NPCs here in Moradon who are waiting to help you, <selfname>. Please go visit the NPCs to receive advice and nice items. "
"35572","View Map |Press M to view the mini map on the top left-hand corner. You can check your current coordinate, ###, ###. |Green Arrow: <selfname>'s coordinate and direction, Blue Dots: NPC, Yellow Dots: Party Members, Red Dots: Monsters"
"35573","Ijin (436, 463) Arena|Go up to Ijin NPC, select and right click. A window will appear nd you can join/create a match. By hosting individual match and clan match, users can compete against one another to find out who the strongest is. "
"35574","Arendil(345, 402) Register Castle Siege War|You can check the schedule for the Castle Siege War. "
"35575","Charon (337, 386) Scrolls|Go up to the Charon, select and right click on the NPC. Select [Trade] and when the item window opens you can drag and drop your item to buy it.|You can purchase scrolls needed for upgrading items."
"35576","Anvil (337, 387)|Go up to the anvil, select and right click on it. A window will appear. Place the item and the upgrade scroll on to the window and press OK.|The item upgrade process will begin.|You can select the chat button on the item upgrade window for more information. "
"35577","Rudien (392, 403) Sundries|Go up to Rudien, select and right click on the NPC. A window will appear. Select [Trade]. When the item window appears you can purchase the item by drag & dropping them on to your inventory.|You can also choose [Repair] to repair your items with low durability. "
"35578","Jerede (464, 274) Handmade Armor|Go up to Jerede, select and right click on the NPC. A window will appear. Select [Trade]. Drag and drop the item to purchase.|Sells items that can be upgraded at the anvil. "
"35579","Amrase (281, 442) Handmade Weapons|Go up to Amrase, select and right click on the NPC. A window will appear. Select [Trade]. Drag and drop the item to purchase.|Sells items that can be upgraded at the anvil. "
"35580","Potions (264, 283), (246, 295)|Go up to Ptoi or Pabian, select and right click on the NPC. A window will appear. Select [Trade]. Drag and drop the item to purchase.|Sells holy waters and potions. Holy waters recovers HP and Potions will recover MP. "
"35581","Nauke (365, 354) Weapons| Go up to Nauke, select and right click on the NPC. A window will appear. Select [Trade]. Drag and drop the item to purchase.|Sells weapons. You can also choose [Repair] to repair your items with low durability. "
"35582","Rospel (319, 426) Armor|Go up to Rospel, select and right click on the NPC. A window will appear. Select [Trade]. Drag and drop the item to purchase.|Sells armors. You can also choose [Repair] to repair your items with low durability."
"35583","Caspy(309, 396) Accessories|Go up to Caspy, select and right click on the NPC. A window will appear. Select [Trade]. Drag and drop the item to purchase.|Sells accessories. "
"35584","Captain Kunabarl(452, 306 Moving NPC)|Go up to Captain Kunabarl, select and right click on the NPC. A window will appear.|Handles quests such as 1st Specialty(Lv10) quest, Redistribute, A duel with the Orc quest(Lv20 or above), Bandicoot Extermination quest, Gem of Bravery quest(Lv20 or above), and Battlefield quest(Lv40 or above). "
"35585","Proconsul (304, 353)|Handles quests such as the New Warrior Mission quest, Beginner Armor Upgrade quest, Goblin Armor quest, Silan Armor quest, Armor of Destruction quest, and Talia Skin quest.|Press the Q button to view the quests you can complete at your current level. "
"35586","Isaac (314, 345)|Handles quests such as the Worm Extermination quest, Gavolt Extermination quest, Collecting Silan Bones quest, Collecting Bulture Horns quest, and Wolf Man extermination quest.| Press the Q button to view the quests you can complete at your current level.  "
"35587","Guard Patrick (370, 306 Moving NPC): In charge of Fangs of Wolf Man Quest (Lv20 and up)|Offering Trader Kim (352, 311 Moving NPC): In charge of sacrificial offering item quests. (Lv20 and up)|Nashira (280, 400 Moving NPC): In charge of Relic Searcher quest. (Lv20 and up)|Priest Veronica (402, 370)|In charge of Zignon quests. (Lv20 and up)"
"35588","Priest Minerva (401, 369)|In charge of priest quests. (Lv60 andup)"
"35589","Using Skills|Press K to view your skill window. You can only use the skills that appears.|Right click on the skill icon and it'll automatically be placed on the 'hot key' window on the left side of your screen. (You can also click and drag the skill icons too)"
"35590","Using skills on hot key|There's a total of 8 hot key pages. You can access the 4 pages by using F1~F4 key. You can have up to 8 skills on each page. You can press 1~8 key to use the skills or by double clicking on the icon. "
"35591","Going to hunt |There are 3 exits out of the Moradon city. The new commers, esquires, can exit through the center gate. "
"35592","Hunting monster|One of the very first monsters you'll encounter are the earth worms. Double click with your mouse or use the Z button to select the target and press R to attack.|Press C to sit down. You can recover HP and MP while you're sitting down. "
"35593","When the monster dies, a wooden box will drop next to the carcass. You can open these box by right clicking on the box.|You can pick up the item by left clicking on the item that appears in the box.|When your inventory is full you can go sell your items to the vendor NPCs in town or deposit them into your storage by visiting the Inn Keeper. "
"35594","Welcome to Breth Village of Karus. We are the descendents of heroes that gave up their lives in the 7 year war. In 492, our forefathers followed the legendary hero Zignon and climbed over the Iskanz Mountain to set up a nation near the Luferson castle. As a descendent of the hero, it's in our blood to become the strongest knights ever. I hope my knowledge was at least a bit helpful to you. "
"35595","You can use the teleport gate to warp to different locations in the Karus nation such as Breth Village, Bellua Village, Linate Village, Lunar Valley Entrance, Kalluga Valley Entrance, Eslant Gate (Lv 40 or above), Goblin Village, and Raon Camp. "
"35596","Hunting monster|One of the very first monsters you'll encounter are the earth worms. Double click with your mouse or use the Z button to select the target and press R to attack.|Press C to sit down. You can recover HP and MP while you're sitting down. "
"35597","Type [/Seeking_Party] in your chatting window. It'll display a message over your character that shows that you are seeking party and add your name on the party seeking board. When you get into a party list of the party members will appear on the right side of your screen. Whe you want to quit party you can type [/Quit_party] in your chatting window. "
"35598","The party system allows you to hunt with many other people. It'll be more fun and you'll get to level up faster. The level difference between the party leader and the members cannot be more than 8 level."
"35599","Inn Keeper (259, 1691)|Go up to the Inn Keeper NPC. Select and right click on the NPC to view your storage. You can store/withdraw items from here.| When you click on the [Access Storage] a window will appear. The left portion is the storage, the lower portion is your inventory. Drag and drop the item to store/withdraw items. To store coins, you can click on the coin. A window will appear. You may type in the amount you want to store/withdraw and press OK. "
"35600","Shama[Healing Potion](368, 1640): Sells holy waters and potions.|Baron[Sundries](325, 1713): Sells arrows, scrolls and other consumable items.|Rawal[Magic item](256, 1723): Sells magic items. |Kamal[Accessories](257, 1716): Sells accessories.|Mori[Arms](302, 1641): Sells various arms and shields. Repairs items with low durability.|Cubense[Armor](345, 1667): Sells armors."
"35601","Great Priest Murka(278, 1681)|In charge of the holy water quest. Only for Priests with Holy Spirit points can do this.|Priests with 30 Holy Spirit point can create the Water of Life (Req. Item : Holy Water + Ingredient for Water of Life), priests with 40 Holy Spirit points can create the Water of Love (Req. Item : Holy Water + Ingredient for Water of Love), priests with 50 Holy Points can create the Water of Grace (Req. Item : Holy Water + Ingredient for Water of Grace), and priests with level 60 can create Water of Favors (Req. Item : Holy Water + Ingredient for Water of Favors)."
"35602","(Shares experience points when in party) Captain Fargo (344, 1704)|He's in charage of the Recoinaissance Report (Lv30 or above) quest and the Guardians of the 7 Keys quest (LV 50 or above). "
"35603","Knight Clerk (345, 1700)|In charge of Knights Quest(quest for clans to become a Knights : The clan must be a grade 3 clan or better.), National Points (Basic National Point quest), and Knights Stipend (Given to top 50 ranking warriors). "
"35604","Habice[Mantle](318, 1625]|In charge of Knights capes and Knights symbol."
"35605","2nd Specialty and Above 60 Level Skill Quest|Warrior Master Skaky (271, 1655 Moving NPC): In charge of Warrior Master specialty and skill quest.|Secret Agent Clarence (Bellua Village 1420, 1290): In charge of Rogue Master specialty and skill quest.|Arch Mage Drake (Linate Village 1560, 430): In charge of Magician Master specialty and skill quests. "
"35606","Minimum of 3 or maximum of 36 people can join. If in the same clan you can form a party without any level restrictions. "
"35607","Go up to Inn Keeper in Breth Village, select and right click on the NPC. Choose [Create Clan].|Type in the clan name and press OK. You'll use 500,000 coins and the clan will be created.|The new clan will be a grade 5 clan. "
"35630","There are no rewards for you to receive. "
"35640","I'm Aban, the battlefield gate keeper. |If you want to test your limits you can enter the battlefield through me. Like the [/town] command, you can use [/individual_battle] command after selecting an opponent, or if you are a clan leader you can use [/clan_battle] to challenge another clan! |Do you want to enter the battlefield? "
"35643","I'll see you later. "
"35645","You are not the head of a clan. "
"35653","You have to have 3 item slots in your inventory free in order to receive the item. "
"35662","In order to prepare for the war that may break out against the Dark Army, many of the younger generation volunteer for a place in the royal guard.|If you visit the palace please give this letter to the royal guard. This is a letter from the village people wishing them well.  "
"35664","If you are going to the palace, please take this letter with you. "
"35665","You're not fit for a job yet. Please go and gain some more experience by hunting. "
"35667","Thank you for delivering the letter. "
"35668","In order to meet the royal guard you must go to the main castle through the warp gate. "
"35670","There are no empty slots in your inventory. "
"35671","Please deliver the letter to the royal guard. "
"35700","Moradon is a safe zone where you cannot be attacked by the monsters but in order to become a true Knight you must fight off the monsters. You can start right away but it'll be better if you gain a little basic knowledge first. It'll help you train and level up a lot more faster. (Moving to hunting zone is for users w/ up to level 5.) "
"35701","Inn Keeper (366,421), (399, 393)|Go up to the Inn Keeper NPC. Select and right click on the NPC to view your storage. You can store/withdraw items from here.| When you click on the [Access Storage] a window will appear. The left portion is the storage, the lower portion is your inventory. Drag and drop the item to store/withdraw items. To store coins, you can click on the coin. A window will appear. You may type in the amount you want to store/withdraw and press OK. "
"35704","You have to level 5 or below to move to the hunting zone. "
"35705","You can choose your specialty when you reach level 10.|Visit Captain Kunabarl (452, 306 Moving NPC) and choose [I want to choose my specialty]. You'll need 3,000 coins to choose your specialty. "
"35706","Welcome to Piana Village of El Morad. We are the descendents of the heroic King Manes who defeated Patos in the 7 Year War. We must help the weak and always on the side of the good. I hope my knowledge was at least a bit helpful. "
"35707","You can use the teleport gate to warp to different location in the El Morad nation such as Piana Village, Asga Village, Raiba Village, Lunar Valley Entrance, Kalluga Valley Entrance, Eslante Entrance (LV40 or above), and Goblin Village. "
