"cp=1252",""
"1 - UInt32","2 - String"
"1","What kind of Holy Water are you looking for? "
"2","The Holy Water has been created. "
"3","You cannot create any more Holy Waters because you have exceeded the possible carrying weight."
"20","Do you want to enter the Forgotten Temple (Kelino Temple)? You are not thinking that it's open to just anybody, are you? Only the chosen ones (Level 60 or above) may enter during the time when the forces of evil are at its strongest (noon and 7PM). ||1.Only the first 32 people may enter.|2. You need 500,000 coins in order to teleport to the Forgotten Temple.|3. You can only earn experience points in the Forgotten Temple.|4. When you are in the Forgotten Temple, if you talk to Priest Athian or use the [/town] command, you'll be teleported to Moradon regardless of your HP amount. You cannot teleport once the Magic Gate is closed.|5. You'll lose 1% of your experience points if you die in the Forgotten Temple.|6. You will receive the Blue Treasure Chest when you kill all the monsters. You can take the chest to Miraselth in Moradon to receive the item inside.|7. There's a 30 minute time limit in the Forgotten Temple. The gates to the temple will close if you are unable to kill all the monsters within 30 minutes.|8. You can party up with people regardless of their nationality. "
"21","The brave group of Knights, Idid, the guardian of the Delos area, has disappeared due to the Igis' curse. At the same time, when Kashan Died, the dark army that was summoned to the Kelino Temple disappeared as well."
"22","A drunken monk was telling us that if we follow the trail in the purple forest, it will lead us to a golden Temple. We walked through the forest but didn't find any golden Temple. Instead we found a staff that was buried in cadavers, which seemed as old as the Temple itself. When Rapion possessed the Staff of Kashan the seal that had locked up the dark force was broken. The power of darkness took over the Kelino Temple. Bellier who was later notified of this incident sent out a group of Knights to the Temple to resolve the problem there, but the whole group was returned as cadavers. "
"23","[The answer can be found from the place of evolution.]|[What do you mean?]|Rapel the prophet continued telling his story.|[Kellino Temple was created by the Limphs that guards the 3 holy grounds. It's a sacred place prohibited to humans. However, through the 3 holy grounds, our group of knights may be able to enter the Kellino Temple.]"
"24","[Delos received the golden light|All evil shall kneel before you,|the fearless warrior!!]|Bashy Knights and mercenary soldiers followed Bellier to the Temple.||In year 682 of the Empire, Bellier's group never returned… And the endless battle had begun."
"25","You are not afraid, are you? Well.. Fighting the Army of Darkness head on will take a lot of guts.. "
"27","You cannot enter the temple right now because the evil power flowing out from the temple is not strong enough. You can enter the temple at noon and at 7PM, when the powers of evil are overwhelmingly active. "
"30","This is the Bas Temple. You need to be level 60 or above to enter!!"
"32","You need to move quickly. Only the first 32 people will be able to enter. "
"34","You need to have 500,000 coins in order to enter the Forgotten Temple. "
"36","Do you want to enter the Forgotten Temple (Kelino Temple)? You are not thinking that it's open to just anybody, are you? Only the chosen ones (Level 46~59 or above) may enter during the time when the forces of evil at Ines Temple are at its strongest (10AM and 5PM). ||1.Only the first 32 people may enter.|2. You need 100,000 coins in order to teleport to the Forgotten Temple.|3. You can only earn experience points in the Forgotten Temple.|4. When you are in the Forgotten Temple, if you talk to Priest Athian or use the [/town] command, you'll be teleported to Moradon regardless of your HP amount. You cannot teleport once the Magic Gate is closed.|5. You'll lose 1% of your experience points if you die in the Forgotten Temple.|6. You will receive the Red Treasure Chest when you kill all the monsters. You can take the chest to Miraselth in Moradon to receive the item inside.|7. There's a 30 minute time limit in the Forgotten Temple. The gates to the temple will close if you are unable to kill all the monsters within 30 minutes.|8. You can party up with people regardless of their nationality."
"41","You cannot enter the temple right now because the evil power flowing out from the temple is not strong enough. You can enter the temple at 10AM and at 5PM, when the powers of evil are overwhelmingly active. "
"44","This is the Ines Temple. You need to be level 46~59 to enter!!"
"48","You need to have 100,000 coins in order to enter the Forgotten Temple. "
"50","Do you want to enter the Forgotten Temple (Kelino Temple)? You are not thinking that it's open to just anybody, are you? Only the chosen ones (Level 46~59 or above) may enter during the time when the forces of evil at Nes Temple are at its strongest (11AM and 6PM). ||1.Only the first 32 people may enter.|2. You need 300,000 coins in order to teleport to the Forgotten Temple.|3. You can only earn experience points in the Forgotten Temple.|4. When you are in the Forgotten Temple, if you talk to Priest Athian or use the [/town] command, you'll be teleported to Moradon regardless of your HP amount. You cannot teleport once the Magic Gate is closed.|5. You'll lose 1% of your experience points if you die in the Forgotten Temple.|6. You will receive the Green Treasure Chest when you kill all the monsters. You can take the chest to Miraselth in Moradon to receive the item inside.|7. There's a 30 minute time limit in the Forgotten Temple. The gates to the temple will close if you are unable to kill all the monsters within 30 minutes.|8. You can party up with people regardless of their nationality."
"55","You cannot enter the temple right now because the evil power flowing out from the temple is not strong enough. You can enter the temple at 11AM and at 6PM, when the powers of evil are overwhelmingly active. "
"58","This is the Nes Temple. You need to be level 46~59 to enter!!"
"62","You need to have 300,000 coins in order to enter the Forgotten Temple. "
"70","The Kellino Temple is currently under the control of the Dark Army, but this holy ground was originally created by the Limphs that were guarding the three sacred holy grounds near by. They hid treasures here. You'll have to eliminate all of the Dark Army in order to earn the treasure. If you bring the treasure chest to me, I'll open it for you free of charge.| Which treasure chest did you bring? "
"71","The Blue Treasure Chest was originally possessed by the Limphs in Bas Temple. You can get the chest by entering the Forgotten Temple through Laemith[Forgotten Temple1]. It should be deep within the temple. I'll open the chest for you if you bring it back to me! |However, I'm uncertain of what's going to be inside the chest. "
"72","The Green Treasure Chest was originally possessed by the Limphs in Nes Temple. You can get the chest by entering the Forgotten Temple through Laedith[Forgotten Temple2]. It should be deep within the temple. I'll open the chest for you if you bring it back to me! |However, I'm uncertain of what's going to be inside the chest. "
"73","The Red Treasure Chest was originally possessed by the Limphs in Ines Temple. You can get the chest by entering the Forgotten Temple through Learth[Forgotten Temple3]. It should be deep within the temple. I'll open the chest for you if you bring it back to me! |However, I'm uncertain of what's going to be inside the chest. "
"74","If you bring me the Blue Treasure Chest from the Forgotten Temple, I'll tell you how to open it. "
"76","You can earn the Blue Treasure Chest by entering the Forgotten Temple through Laemith and eliminating all of the Dark Army inside it. "
"78","You have received the item that was in the Blue Treasure Chest. May the blessings of Bas Temple be with you.. Always.. "
"79","If you bring me the Green Treasure Chest from the Forgotten Temple, I'll tell you how to open it. "
"80","You can earn the Green Treasure Chest by entering the Forgotten Temple through Laemith and eliminating all of the Dark Army inside it. "
"81","You have received the item that was in the Green Treasure Chest. May the blessings of Bas Temple be with you.. Always.. "
"82","If you bring me the Red Treasure Chest from the Forgotten Temple, I'll tell you how to open it. "
"83","You can earn the Red Treasure Chest by entering the Forgotten Temple through Laemith and eliminating all of the Dark Army inside it. "
"84","You have received the item that was in the Red Treasure Chest. May the blessings of Bas Temple be with you.. Always.. "
"1001","You want more power?  Then do me a favor.. I'll give you what you really want!! Keke"
"1002","Hey! Stupid! Why don't you come back when you are stronger!!  Keke"
"1003","You desire to become stronger..  OK! You know about Logos, the creator of the ancient Adonis Continent, right?  Keke.. Of course you do.. On this continent there were six countries, and throughout these countries were the shrines of Logos.  "
"1004","Of course, that is before Patos destroyed the world.  You've heard of the legend that there are weapons and armors that are located within the Logos shrines, right?  The ones that have been blessed by the Gods.. "
"1005","Interesting, isn't it?  Among these blessed items is an item called Talia Skin.. This is an extremely valuable item.  The cheap armor you're wearing is nothig compared to this!!  I can give you the 'Armor of Destruction'.."
"1006","However, nothing is for free.. I need you to do me a few favors.  I'm conducting a study on the Golems and I need you to fetch me the teeth of  Smilodon, the nails of Stegodon, and the heart of a Haunga which revives Golems.     "
"1007","Oh.. I also need the scales of the Gloom Wing in order to repair Armor of Destruction.  Bring me what I want, and I'll bless you with an incredible strength. "
"1008","Hehe… I knew it.. This should be unexpected for a coward like you.. "
"1009","Hehe.. You've done it.. As promised, I'll give you the Armor of Destruction.. "
"1010","You've returned as I expected.. The Armor of Destruction is yours.. Or should I say, you are now owned by the Armor of Destruction.. Hehe.. "
"1011","This is the Pads of Destruction.. Don't forget, the name of this armor is the Armor of Destruction!! "
"1012","Gauntlet of Destruction!!  Everybody wants one, but not everybody can own one.. Looks like the Gauntlet wants you~!!  "
"1013","Here.. Take the Boots of Destruction.. Be careful.. The curse that's been casted on these boots might take you to hell…  "
"1014","Here's the Belt of Destruction.. I wonder if you can stand the wrath of the curse..  "
"1015","Which one do you want? "
"1016","15 tooth of Smilodon, 15 nails of Stegodon, 5 hearts of Haunga, and 10 scales of Gloom Wing  "
"1017","30 tooth of Smilodon, 20 nails of Stegodon, 15 hearts of Haunga, and 30 scales of Gloom Wing  "
"1018","30 tooth of Smilodon, 20 nails of Stegodon, 15 hearts of Haunga, and 30 scales of Gloom Wing  "
"1019","10 tooth of Smilodon, 20 nails of Stegodon, 3 hearts of Haunga, and 10 scales of Gloom Wing  "
"1020","10 tooth of Smilodon, 20 nails of Stegodon, 3 hearts of Haunga, and 10 scales of Gloom Wing  "
"1021","10 tooth of Smilodon, 15 nails of Stegodon, 3 hearts of Haunga, and 10 scales of Gloom Wing  "
"1022","You're greedy!! Don't you already have this?? "
"1023","This is not enough.. Too bad.. "
"1050","Tell your clan leader that this mission can only be accomplished by a clan leader. "
"1051","The Knights are the combat unit authorized by the Emperor. Being a Knight requires a Level 3 Clan Certificate which proves your service for the country. In addition, you should show your courage and skills. Right now, at the Colosseum, Caitharos is waiting for you. Duel with and beat Caitharos, bringing [Brain of Centaur] together with Knight registration fee of 10 million Coin."
"1052","You will face lots of challenges at the Colosseum. For the Knight qualification test, all clan members in the main nation will be teleported into the Coloseum. There's no classification of ally or enemy in this zone. Everybody is your enemy! You can also receive attacks from the opposing nation. Only the strongest will obtain the [Brain of Centaur]"
"1053","You might lose your valuable experience points or get locked up in the Colosseum. Or you may even lose to another clan and lose your [Brain of Centaur]"
"1054","The most important thing is that you, the clan leader, must get it personally. Your friends may help you to defeat the Caitharos, but they cannot get the [Brain of Centaur] for you. Mark my words!! Good luck!!"
"1055","Your clan needs to put in more service for your nation. Only the clans with with grade 3 or above are allowed to become a Knights. "
"1056","I'll wait for some good news. Good luck!"
"1057","You don't have enough coins. You need 10 million coins in order to register the Knights. "
"1058","You need to retrieve the [Brain of Centaur] from Caitharos to qualify for becoming a Knights."
"1059","There's nothing more I can do for you. Go and walk the path of a hero!!"
"1060","I knew you'd come back. Did you bring the [Brain of Centaur]? "
"1061","Would you like to try again? "
"1062","Congratulations on becoming an honorable Knights. You now qualify to rule the castle in the new zone in the name of the emperor. "
"1100","Did you meet the advisor from the castle? If you've talked to him you probably know who I am|OK, which spy scroll do you need? "
"1102","Did you deliver the secret scroll that I gave you last time to the Advisor?"
"1103","Please deliver the Dark Lunar secret scroll to the Advisor. "
"1105","Please visit the Advisor inside Luferson Castle first. "
"1106","Please visit the Advisor inside El Morad Castle first. "
"1203","Please deliver the Lunar secret scroll to the advisor."
"2001","You want the blessings of God?  Then do me a favor. If you do, then the God of Evolution, the Logos will bless your armor.. "
"2002","Hey wimp.. Go visit  Limon..  Limon will judge if you are qualified to be blessed by the God or not.. "
"2003","Oh~~ The Armor of Destruction.. Hmm.. It's a very rare and valuable item.. The Armor of Destruction will destroy its owner if the owner does not have enough faith in it.. It's a very valuable item and it's cursed by Patos.. "
"2004","In order to disable the curse, you need to receive a blessing from the Logos to change it to Talia Skin.. Do you want to do this?  I bet you do.. However.. I'm going to have to receive something in return for my blessing.. "
"2005","Lately, the guys in the 'Valley of the Lost Souls' are acting suspiciously. Their evilness must be supressed. In order to do this, I need a Bone of Dragon Tooth and the Blood of Dark Mage. "
"2006","If you bring these to me, I'll give you the blessings of Logos. Also, have 100,000 coins for offering when you are blessed. Becareful.. Watch out for the shadows of death.. "
"2007","Hmm, The Shadow of Death is hanging over you. Someday the Armor of Destruction will lead you to hell!! Hahaha.. "
"2008","You're back!! Talia Skin Helmet is yours. May the blessing of Logos be with you.. "
"2009","You must have great faith. You deserve to become the owner of Talia Skin..  May the blessing of Logos be with you.. "
"2010","You're now a owner of  the Talia Skin Armor. May the blessing of Logos be with you.."
"2011","Here's the Talia Skin Gauntlet. Try it on. I bet you're not going to want to take it off..  May the blessing of Logos be with you.. "
"2012","The Talia Skin Boots will protect you.. May the blessing of Logos be with you.. "
"2013","Here's the Talia Skin Belt.. It strikes me everytime, doesn't it look great!? May the blessing of Logos be with you. "
"2014","Which one do you want? "
"2015","10 Bones of Dragon Tooth, 20 Blood of Dark Mage, and 100,000 coins"
"2016","You're greedy!! Don't you already have this?? "
"2017","This is not enough.. Too bad.. "
"3001","Hello. ^^  Please enter the coupon number. "
"3002","The coupon number is invalid.  Please start over. "
"3003","Received 10,000 Coins.  Use them wisely~! ^^"
"3004","Wow~!!  A sword with extra powers~!!  You're lucky~!!"
"3005","Wow~!!  A bow with extra powers~!!  You're lucky~!!"
"3006","Wow~!!  A staff with extra powers~!!  You're lucky~!!"
"3007","Wow~!!  An iron hammer with extra powers~!!  You're lucky~!!"
"4001","Will you use your Gift Card? "
"4002","Have a good time. "
"4003","Please enter the Gift Card serial number below. "
"4004","Card number and/or Password error.  Please try again. "
"4005","Please take this mysterious present, brave one. "
"4006","Please take this 50,000 gold, brave one. Please use them wisely. "
"4007","Please double check your card number. If you already used it before, you cannot use it again. "
"4008","Do you want to get a present? "
"4009","You have no empty slot."
"5001","The emperor has sent a reward to your bravery and heroic efforts in the war. "
"6000","I'm the Warrior Master Skaky!! Do you want to learn your Master skills? "
"6001","I'm the Warrior Master Skaky!! I'm responsible for training warriors. You need to be level 60 in order to learn the Master skill. "
"6002","The war with Patos, the God of Destruction, has ended. However, our world is still in a chaos. Our decision to stay out of the war between the Gods and the humans were wrong.  ||The wolves that drank the blood of Patos stood upright and have turned into his loyal soldier. Their fear is gone along with Patos.. It seems like they are going to cause more trouble than before. ||My brave warrior! Prove your bravery to me! Hunt these wolves... the Lobo, Lupu, and Lycaon. Hunt them down and bringn me [a Lobo Pendant, a Lupus Pendant, a Lycaon Pendant, 10 Crystals, 10 Opals, and 10 Crude Sapphires]. "
"6003","You cannot become a warrior if you can't prove your bravery. "
"6004","Did you bring the proof to become a Master? Then show it to me!"
"6005","Warrior, you kept your word! Warrior Master Skaky will pass you the ancient power of the dragon."
"6006","Warrior, you already have the power of Master."
"6007","Warrior, you have to show me a solid proof."
"6011","The warrior's bravery and sacrifice is what's keeping this world in order. Warrior, show us your bravery!!"
"7000","My name is Clarence, the representative of Rogue Guild and the Guardian of Secrets. Do you want to qualify to become a master? "
"7001","I, Clarence, as the Representative of Rogue Guild, am telling the secrets of the seniors to the rogues. from the senior people to rogues. Only the rogues with level 60 or above are allowed to become Kasar Hood or Shadow Vein. "
"7002","The seniors of Rogue Guild want the following items to develop ancient weapons and assassination skills;|[a Shaula Tail, a Lesath Tail, Blood of Glyptodont(10 pcs.), a Fang of Barkirra, Crystal(10 pcs.), Opal(10 pcs.), Crude Sapphire(10 pcs.)] | The seniors will allow you to have great powers if you fetch these things for them."
"7003","Please come see me if you want to find out more about the seniors' secrets."
"7004","Did you bring the materials I asked for? "
"7005","You brought everything the seniors requested. The seniors will allow you to have great powers."
"7006","Rogues should keep the seniors' secrets. Don't forget about keeping the secret!"
"7007","You're not ready yet. You do not have all the things that I require. "
"7011","In that case, I'll refer to the seniors about your specialty. "
"7050","Welcome to Moradon, the city of peace and trade! | I'm Proconsul, the master of blacksmith guild. I'm the head of all the blacksmiths!! We can make items that would be very tempting for warriors like you. || So, tell me. What're you looking for?"
"7105","Did you hear about the rumor that the Goblins lived in the deserted land had build their own village in both El Morad and Karus? "
"7110","To tell you the truth, we blacksmiths do not care about Goblins. However, we are interested in the armors that they are wearing."
"7120","Although the Goblins have poor skills in making armors, the quality of the materials they use are very nice. If we can just put a little finishing touch to it, I'm confident that it'll become a great armor!"
"7130","If you bring the Goblin Armor, I'll have our guild members repair it. If you don't have a nice armor yet, this should be a good chance for you to get one. Of course, nothing is free…, just a little material cost and a service fee, as you know, we need to make a living too. "
"7140","You can ask anybody in the square over there where you'll be able to meet Goblins. If you are lucky, maybe some kind person will help you. Well then, Take care!"
"7145","One thing to note is that for someone big like you will need [5 pcs. Of Goblin Armor]!! Think about Goblin's small size!"
"7150","You brought the Goblin Armor? Good, then I'll make an armor for you. I need 5 pcs. Of Goblin Armor to make one that would fit you. What kind of Armor did you get? Oh, one more thing.. You also need to pay the fee below in order to make the armor. || 100 thousand coin for Goblin Pauldron | 80 thousand coin for Goblin Pads | 50 thousand coin for Goblin Helmet | 40 thousand for Goblin Gauntlet | 30 thousand coin for Goblin Boots"
"7160","You should have at least 5 pcs. Of Goblin Armor to make one for yourself. Compare the size of your body with the Goblin's!"
"7170","Hmm... You don't have enough money. Sorry to say this but we won't be making any money if we charge you the just the material cost. "
"7190","Oh, you've really been to the Goblin village! You're much braver than I expected!"
"7200","As I told you before, we can make magic armors out of Goblin's armors. | But don't let the outer form fool you, the result may vary. | Some may become great armors, but in some cases, some may become some what less of a great armor.  "
"7210","I cannot tell what kind of armor will be produced. Well, what do you say? Do you want me to make one for you?"
"7220","Hmm.. In order to make a Goblin Pauldron.. Including material cost, service fees, and etc.. It'll cost you 100,000 coins. "
"7230","Hmm.. In order to make a Goblin Pad.. Including material cost, service fees, and etc.. It'll cost you 80,000 coins. "
"7240","Hmm.. In order to make a Goblin Helmet.. Including material cost, service fees, and etc.. It'll cost you 50,000 coins. "
"7250","Hmm.. In order to make a Goblin Gauntlet.. Including material cost, service fees, and etc.. It'll cost you 40,000 coins. "
"7260","Hmm.. In order to make a Goblin Boots.. Including material cost, service fees, and etc.. It'll cost you 30,000 coins. "
"7280","I guess you're not interested in Goblin Armors. Well then, farewell and come back again if you ever need our help. "
"7310","Oh boy.. This armor is a failure. I'm sorry.. Well it's not that bad, it'll still be useful, so please don't too disappointed. "
"7320","We can make this kind of armors out of most Goblin Armors. If you want a better one, please get more Goblin Armors. If you're lucky you might end up with a great armor. "
"7330","You must be a lucky guy to get such a great armor out of Goblin armor."
"7340","Oh, wow! You're very lucky!! An armor of this caliber will stand out wherever you go. "
"7350","Oh, my goodness! It's almost impossible to make such an awsome armor out of Goblin Armors…, you're really lucky. "
"7551","Do you want to know about Armor of Destruction? Or did you bring back the materials? "
"7553","Such adventurers like you might dream of becoming more stronger than others. Well then, do you have any idea what we're dreaming about? We want to make a sword with the sharpest blade and make solid armors that nothing can thrust through!! || With these goals, we don't stop feeding the fire, blowing with the bellows and striking irons, just like you, constantly trying to make yourself stronger. || While warriors would sell their souls to become stronger, we had made a deal with he magicians in order to make better items l "
"7554","Based on what we learned from the sorcerers, we poured magic forces from [Talisman of Destruction] into the burning furnace to make a new kind of metal. || When this new creation was made from the furnace, we shouted with joy. But soon, we were facing a problem. The metal was too hard and we couldn't change its shape with our hammers and anvil. In other words, it was impossible to make an armor out of this net metal. So we had no choice but to be satisfied by placing the sheet metals on a leather armor. This armor that we created is called the Armor of Destruction. "
"7555","And then we faced another problem. We were unable to fix the metal if it was broken. haha.. Although it's very strong, the Armor of Destruction doesn't last long. What do you think? The name suits the armor, right? || As I told you before, the Armor of Destruction requires [Scroll of Destruction] in order to be made. There are monsters called Hell Hounds in the El Morad and Karus. They originated from dead Smilodons that were brought back alive by eveil necromancers. When you kill them, you'll be able to get the [Talisman of Destruction]. "
"7556","Oh, one more thing!! After Brin Mine closed down, the [Iron Bars] are not sold in the market anymore. I'd like you to get some for me. The easiest way for an adventurer to obtain [Iron Bar] is to hunt Bulcans. They dig and feed on earth. They excrete the earth but the iron that was in the earth are stored in their body. "
